"8ZC33Z6V","book","1925","","Monographie de la province de Baclieu , par Louis Girerd,...","","","","","http://gallica.bnf.fr/ark:/12148/bpt6k5844090p","","1925","2021-03-30 07:56:57","2021-03-30 07:56:57","2021-03-30 07:56:51","","","","","","","","","","","","Impr. de l'Union Nguyen-van-cua","Saïgon","fre","","","","","BnF Catalogue général (http://catalogue.bnf.fr)","Tolbiac - Rez de Jardin - Philosophie, histoire, sciences de l'homme - Magasin - 8-LK10-698","Country: VN","","","http://catalogue.bnf.fr/ark:/12148/cb34137469g","","France -- Colonies -- Histoire (HA); Cochinchine (Vietnam) (HA)","","","","","","","","","","","","","","","","","","","","","","","","","","","","","","","","","","","","","","","","","","","","","",""
"SUCG3H87","book","1925","Mignon, Georges","Premières notions de psychologie secondaire en Indo-Chine avec des applications à l'éducation, par Georges Mignon,...","","","","","","","1925","2021-03-30 07:56:57","2021-03-30 07:56:57","","","","","","","","","","","","","impr. de l'Union Nguyen-Van-Cua","Saïgon","fre","","","","","BnF Catalogue général (http://catalogue.bnf.fr)","Tolbiac - Rez de Jardin - Philosophie, histoire, sciences de l'homme - Magasin - 8-R-33897","Country: VN Écoles normales et enseignement secondaire local de l'Indochine. [Programmes de 1925.","","","http://catalogue.bnf.fr/ark:/12148/cb309458067","","","","","","","","","","","","","","","","","","","","","","","","","","","","","","","","","","","","","","","","","","","","","","","",""
"JDKWFJML","book","1925","Trâǹ, Phong Săć","Sỉ-hũư-bá-hạnh... ""Cours de morale à l'usage des écoliers annamites, 100 leçons""...","","","","","http://gallica.bnf.fr/ark:/12148/bpt6k4227995k","","1925","2021-03-30 07:56:57","2021-03-30 07:56:57","2021-03-30 07:56:52","","","","","","","","","","","","impr. de l'Union Nguyễn-Văn-Của","Sàigòn","fre","","","","","BnF Catalogue général (http://catalogue.bnf.fr)","Tolbiac - Rez de Jardin - Littérature et art - Magasin - 8-INDOCH-315","Country: FR En vietnamien.","","","http://catalogue.bnf.fr/ark:/12148/cb31489336v","","","","","","","","","","","","","","","","","","","","","","","","","","","","","","","","","","","","","","","","","","","","","","","",""
"BTJKN2YD","book","1925","Lê-Văn-Tiếng","Tuồng cải-luơn̛g. @ Miêu-ly hoán-chúa... chủ-bút Lê-Văn-Tiếng,... publié par A. Abdoul Mougamadou...","","","","","http://gallica.bnf.fr/ark:/12148/bpt6k4228037b","","1925","2021-03-30 07:56:57","2021-07-13 12:38:45","2021-03-30 07:56:53","","","","","","","","","","","","Impr. de l'Union Nguyen-Văn-Cua","Saigon","fre","","","","","BnF Catalogue général (http://catalogue.bnf.fr)","Tolbiac - Rez de Jardin - Littérature et art - Magasin - 8-INDOCH-246","Country: FR [Théâtre.","","","http://catalogue.bnf.fr/ark:/12148/cb30808327j","","","","","","","","","","","","","","","","","","","","","","","","","","","","","","","","","","","","","","","","","","","","","","","",""
"ZBAQ9FY8","book","1926","Tru n̛g Thành Thu n̛g","Compte rendu de M. Truong-Thành-Thuong, conseiller colonial, de son mandat de 1922 à 1926","","","","","http://gallica.bnf.fr/ark:/12148/bpt6k61121102","","1926","2021-03-30 07:56:57","2021-03-30 07:56:57","2021-03-30 07:56:54","","45","","","","","","","","","","Impr. de l'Union Nguyên-vàn-Cua","Saïgon","fre","","","","","BnF Catalogue général (http://catalogue.bnf.fr)","Tolbiac - Rez de Jardin - Philosophie, histoire, sciences de l'homme - Magasin - 8-LK19-573","Country: VN in-8.","","","http://catalogue.bnf.fr/ark:/12148/cb341443461","","France -- Colonies -- Administration -- Histoire (HA); France -- Colonies -- Politique et gouvernement -- Histoire (HA)","Indochine française","","","","","","","","","","","","","","","","","","","","","","","","","","","","","","","","","","","","","","","","","","","","",""
"LENMJZ4W","book","1926","Nguyên-Thi-Vinh","Ðại-bi tâm-kinh... Nguyễn-Thị-Vịnh,...","","","","","http://gallica.bnf.fr/ark:/12148/bpt6k42363838","","1926","2021-03-30 07:56:57","2021-03-30 07:56:57","2021-03-30 07:56:54","","","","","","","","","","","","Impr. de l'Union Nguyễn-vān-Của","Saïgon","fre","","","","","BnF Catalogue général (http://catalogue.bnf.fr)","Tolbiac - Rez de Jardin - Littérature et art - Magasin - 8-INDOCH PIECE-11","Country: FR [Prières bouddhiques : Dai-bi tâm-kinh.","","","http://catalogue.bnf.fr/ark:/12148/cb310137669","","","","","","","","","","","","","","","","","","","","","","","","","","","","","","","","","","","","","","","","","","","","","","","",""
"Y72JZTSG","book","1926","Truơn̛g, Văn Minh","Dũ ̛nhon̛ đồng lạc thiện tông kiến","","","","","http://gallica.bnf.fr/ark:/12148/bpt6k4236532n","Prières bouddhiques","1926","2021-03-30 07:56:57","2021-03-30 07:56:57","2021-03-30 07:56:55","","21","","","","","","","","","","Impr. de l'Union Nguyễn văn Của","Sài Gòn","vie","","","","","BnF Catalogue général (http://catalogue.bnf.fr)","Tolbiac - Rez de Jardin - Littérature et art - Magasin - 8-INDOCH PIECE-23","Country: VN in-8.","","","http://catalogue.bnf.fr/ark:/12148/cb357602153","","","","","","","","","","","","","","","","","","","","","","","","","","","","","","","","","","","","","","","","","","","","","","","",""
"6MK3GTUL","book","1926","Nguyễn, Tính Yên; Trâǹ, Huy Liệu","Nguyễn-Tính-Yên. Cái thây-ma ché̀t oan...","","","","","http://gallica.bnf.fr/ark:/12148/bpt6k42279448","","1926","2021-03-30 07:56:57","2021-03-30 07:56:57","2021-03-30 07:56:56","","50","","","","","","","","","","impr. de Ngu̇yễn-văn-Của","Saïgon","fre","","","","","BnF Catalogue général (http://catalogue.bnf.fr)","Tolbiac - Rez de Jardin - Littérature et art - Magasin - 8-INDOCH-193","Country: FR [Un mort injuste. [Une mort injuste, roman.","","","http://catalogue.bnf.fr/ark:/12148/cb31013809r","","","","","","","","","","","","","","","","","","","","","","","","","","","","","","","","","","","","","","","","","","","","","","","",""
"CV29CKXZ","book","1926","","Réponse des avocats-défenseurs de la Cochinchine et du Cambodge au questionnaire relatif à la constitution de barreaux en Indochine","","","","","","","1926","2021-03-30 07:56:57","2021-03-30 07:56:57","","","20","","","","","","","","","","Impr. de l'Union Nguyên-Vân-Cua","Saïgon","fre","","","","","BnF Catalogue général (http://catalogue.bnf.fr)","Tolbiac - Rez de Jardin - Philosophie, histoire, sciences de l'homme - Magasin - 4-LF125-297","Country: VN","","","http://catalogue.bnf.fr/ark:/12148/cb340692586","","Avocats -- France (1789-....); Cochinchine (HA)","","","","","","","","","","","","","","","","","","","","","","","","","","","","","","","","","","","","","","","","","","","","","",""
"CST8PBGI","book","1927","Trần-Dằng-Huy","Công-Quá-Cách diễn ca...","","","","","http://gallica.bnf.fr/ark:/12148/bpt6k4236705f","","1927","2021-03-30 07:56:57","2021-03-30 07:56:57","2021-03-30 07:56:57","","16","","","","","","","","","","impr. de Nguyễn-Văn-Của","Sàigòn","fre","","","","","BnF Catalogue général (http://catalogue.bnf.fr)","Tolbiac - Rez de Jardin - Littérature et art - Magasin - 8-INDOCH PIECE-389","Country: FR","","","http://catalogue.bnf.fr/ark:/12148/cb314890826","","","","","","","","","","","","","","","","","","","","","","","","","","","","","","","","","","","","","","","","","","","","","","","",""
"E3HDL8VE","book","1927","Tavernier, Émile","La famille annamite","","","","","","","1927","2021-03-30 07:57:21","2021-03-30 07:57:21","","","107","","","1","","","","","","","éd. Nguyen-Van-Cua","Saïgon","fre","","","","","BnF Catalogue général (http://catalogue.bnf.fr)","Tolbiac - Rez de Jardin - Philosophie, histoire, sciences de l'homme - Magasin - 4-LK10-710 (1)","Country: VN figure. in-4. Publication de la Commission Luro faite sous le patronage de la Société des études indochinoises. Un acte de mariage en caractères annamites sur papier rouge est joint à l'ouvrage qui comporte, dans ses annexes, une traduction de ce document.","","","http://catalogue.bnf.fr/ark:/12148/cb314373846","","France -- Colonies -- Histoire (HA); Annam (HA)","","","","","","","","","","","","","","","","","","","","","","","","","","","","","","","","","","","","","","","","","","","","","",""
"IGXKUBQA","book","1927","Boeuf, Abel","Abel Boeuf, chef de bataillon d'infanterie coloniale. Histoire de la conquête de la Cochinchine (1858-1861)","","","","","","","1927","2021-03-30 07:57:21","2021-03-30 07:57:21","","","","","","","","","","","","","éditions Nguyen-Van-Cua","Saïgon","fre","","","","","BnF Catalogue général (http://catalogue.bnf.fr)","Tolbiac - Rez de Jardin - Philosophie, histoire, sciences de l'homme - Magasin - 4-LH4-4170","Country: VN Publication de la Commission Philastre, faite sous le patronage de la Société des études indochinoises.","","","http://catalogue.bnf.fr/ark:/12148/cb34084620t","","","","","","","","","","","","","","","","","","","","","","","","","","","","","","","","","","","","","","","","","","","","","","","",""
"8B6VAWHM","book","1927","Nguyễn, Công Manh","Tam-hạp bũư kiêm... nguời̛ viêt, Nguyễn-công-Manh,...","","","","","http://gallica.bnf.fr/ark:/12148/bpt6k4229982k","","1927","2021-03-30 07:57:21","2021-03-30 07:57:21","2021-03-30 07:57:11","","56","","","","","","","","","","impr. de Nguyễn-văn-Cua","Hanoi","fre","","","","","BnF Catalogue général (http://catalogue.bnf.fr)","Tolbiac - Rez de Jardin - Littérature et art - Magasin - 8-INDOCH-687","Country: FR","","","http://catalogue.bnf.fr/ark:/12148/cb310132527","","","","","","","","","","","","","","","","","","","","","","","","","","","","","","","","","","","","","","","","","","","","","","","",""
"FXK58WHG","book","1927","Nguyên-Thi-Truyên","Trân-Thái-Nguyên và Nguyễn-Thi-Truvện. Luơn̛g duyên túc đè...","","","","","http://gallica.bnf.fr/ark:/12148/bpt6k4228554k","","1927","2021-03-30 07:57:21","2021-03-30 07:57:21","2021-03-30 07:57:12","","","","","","","","","","","","Impr. de l'Union Nguyễn-vàn-Cúa","Saïgon","fre","","","","","BnF Catalogue général (http://catalogue.bnf.fr)","Tolbiac - Rez de Jardin - Littérature et art - Magasin - 8-INDOCH-443","Country: FR [L'amour prédestiné. 1re édition.","","","http://catalogue.bnf.fr/ark:/12148/cb31013764m","","","","","","","","","","","","","","","","","","","","","","","","","","","","","","","","","","","","","","","","","","","","","","","",""
"UD4TYH9Z","book","1928","Reyboubet","Comment je corrige mes fautes de français. Ne dites pas : Dites :, par Reyboubet. Cahier du maître et de l'élève","","","","","","","1928","2021-03-30 07:57:21","2021-03-30 07:57:21","","","","","","","","Comment je corrige mes fautes de français. Ne dites pas","","","","","Impr. de l'Union Nguyên-Van-Cua","Saïgon","fre","","","","","BnF Catalogue général (http://catalogue.bnf.fr)","Tolbiac - Rez de Jardin - Littérature et art - Magasin - 8-X PIECE-2881","Country: VN","","","http://catalogue.bnf.fr/ark:/12148/cb312045277","","","","","","","","","","","","","","","","","","","","","","","","","","","","","","","","","","","","","","","","","","","","","","","",""
"BLD3PUEE","book","1928","Nguyên, Văn Năm","Tân-thùc-Báo đả Ðống-Ky","","","","","http://gallica.bnf.fr/ark:/12148/bpt6k4239759x","","1928","2021-03-30 07:57:21","2021-03-30 07:57:21","2021-03-30 07:57:13","","","","","","","","","","","","Impr. Nguyễn-văn-Của","Saigon","fre","","","","","BnF Catalogue général (http://catalogue.bnf.fr)","Tolbiac - Rez de Jardin - Littérature et art - Magasin - 8-INDOCH PIECE-889","Country: FR [La victoire remportée par Tẩn-thúc-Bảo sur Dông-Ký.","","","http://catalogue.bnf.fr/ark:/12148/cb31013968j","","","","","","","","","","","","","","","","","","","","","","","","","","","","","","","","","","","","","","","","","","","","","","","",""
"9IMPA9GQ","book","1929","","Société maritime indochinoise. Contrat passé entre le gouvernement général de l'Indochine et la Société maritime indochinoise pour l'exploitation des services maritimes postaux sur Singapore, Bangkok, les Indes néerlandaises et le sud de la Chine","","","","","","","1929","2021-03-30 07:57:21","2021-03-30 07:57:21","","","26","","","","","","","","","","Impr. de l'Union Nguyên-van-Cua","Saïgon","fre","","","","","BnF Catalogue général (http://catalogue.bnf.fr)","Tolbiac - Rez de Jardin - Sciences et technique - Magasin - 8-V PIECE-23473","Country: VN","","","http://catalogue.bnf.fr/ark:/12148/cb33606572h","","","Société maritime indochinoise","","","","","","","","","","","","","","","","","","","","","","","","","","","","","","","","","","","","","","","","","","","","",""
"GG56YZZR","book","1929","Minh-Khai","Diếu luật và tu cách cho-i bóng tròn","","","","","http://gallica.bnf.fr/ark:/12148/bpt6k4233292z","","1929","2021-03-30 07:57:21","2021-03-30 07:57:21","2021-03-30 07:57:14","","","","","","","","","","","","impr. de Nguyên-văn-Của","Saigon","fre","","","","","BnF Catalogue général (http://catalogue.bnf.fr)","Tolbiac - Rez de Jardin - Littérature et art - Magasin - 8-INDOCH-1235","Country: FR Foot-ball association.","","","http://catalogue.bnf.fr/ark:/12148/cb30950735j","","","","","","","","","","","","","","","","","","","","","","","","","","","","","","","","","","","","","","","","","","","","","","","",""
"LDTYKXF6","book","1929","Nhị Thiên Ðuờn̛g","Nhi-Thiên-Ðuờn̛g...","","","","","http://gallica.bnf.fr/ark:/12148/bpt6k4230393s","Pharmacie Nhi-Thiên-Ðuờn̛g. Catalogue","1929","2021-03-30 07:57:21","2021-03-30 07:57:21","2021-03-30 07:57:15","","336","","","","","","","","","","impr. Nguyễn Văn Của","Sài Gòn","fre","","","","","BnF Catalogue général (http://catalogue.bnf.fr)","Tolbiac - Rez de Jardin - Littérature et art - Magasin - 8-INDOCH-875","Country: FR ill., couv. ill. en coul. 1929 d'après le dépôt légal.","","","http://catalogue.bnf.fr/ark:/12148/cb35757441p","","","","","","","","","","","","","","","","","","","","","","","","","","","","","","","","","","","","","","","","","","","","","","","",""
"LPC7BUDR","book","1929","","Plan d'une monographie provinciale","","","","","http://gallica.bnf.fr/ark:/12148/bpt6k58468776","","1929","2021-03-30 07:57:21","2021-03-30 07:57:21","2021-03-30 07:57:16","","","","","","","","","","","","Impr. de l'Union Nguyên-Van-Cua","Saigon","fre","","","","","BnF Catalogue général (http://catalogue.bnf.fr)","Tolbiac - Rez de Jardin - Philosophie, histoire, sciences de l'homme - Magasin - 8-LK10-743","Country: VN","","","http://catalogue.bnf.fr/ark:/12148/cb341374831","","France -- Colonies -- Histoire (HA); Cochinchine (Vietnam) (HA)","","","","","","","","","","","","","","","","","","","","","","","","","","","","","","","","","","","","","","","","","","","","","",""
"EX3INTMK","book","1929","","Ville de Saïgon. Recueil des textes concernant l'hygiène et la santé publique dans la ville de Saïgon, par Trân-Nguyên-Chân,...","","","","","","","1929","2021-03-30 07:57:21","2021-03-30 07:57:21","","","","","","","","","","","","","impr. de Nguyên-Van-Cua","Saïgon","fre","","","","","BnF Catalogue général (http://catalogue.bnf.fr)","Tolbiac - Rez de Jardin - Droit, économie, politique - Magasin - 8-F-43047","Country: VN","","","http://catalogue.bnf.fr/ark:/12148/cb336456235","","","Saigon","","","","","","","","","","","","","","","","","","","","","","","","","","","","","","","","","","","","","","","","","","","","",""
"4WWSAI36","book","1930","Tô-Văn-Qua","Các sắc thuế chánh ngạch trong xú ̛Nam-Kỳ...","","","","","http://gallica.bnf.fr/ark:/12148/bpt6k4231317q","","1930","2021-03-30 07:57:21","2021-03-30 07:57:21","2021-03-30 07:57:17","","","","","","","","","","","","impr. de l'Union Nguyễn-Văn-Của","Saïgon","fre","","","","","BnF Catalogue général (http://catalogue.bnf.fr)","Tolbiac - Rez de Jardin - Littérature et art - Magasin - 8-INDOCH-1505","Country: FR","","","http://catalogue.bnf.fr/ark:/12148/cb31475655s","","","","","","","","","","","","","","","","","","","","","","","","","","","","","","","","","","","","","","","","","","","","","","","",""
"VPGBB65N","book","1930","Tô-Văn-Qua","Recueil des textes réglementant les impôts directs et taxes assimilées perçus en Cochinchine, par Tô-Văn-Qua,... Préface de Pierre Nadal,... 2e édition","","","","","","","1930","2021-03-30 07:57:21","2021-03-30 07:57:21","","","","","","","","","","","","","impr. de l'Union Nguyễn-Văn-Của","Saïgon","fre","","","","","BnF Catalogue général (http://catalogue.bnf.fr)","Tolbiac - Rez de Jardin - Droit, économie, politique - Magasin - 8-F-33847","Country: VN","","","http://catalogue.bnf.fr/ark:/12148/cb31475657g","","","","","","","","","","","","","","","","","","","","","","","","","","","","","","","","","","","","","","","","","","","","","","","",""
"UYTTGRBA","book","1930","Trâǹ, Công Ðôǹg","Tai-Sanh-Duyên Manh-lê-Quân toàn truyen publié par I. Tran-Cong-Dong photographe, 93, boulevard Charner, Saigon. Cuõn thú Bay","","","","","","","1930","2021-03-30 07:57:21","2021-03-30 07:57:21","","","","","","","","","","","","","","Saigon, Impr. de l'Union. Nguyen-Van-Cua, 157, rue Catinat","vie","","","","","BnF Catalogue général (http://catalogue.bnf.fr)","","Country: VN","","","http://catalogue.bnf.fr/ark:/12148/cb32654845v","","","","","","","","","","","","","","","","","","","","","","","","","","","","","","","","","","","","","","","","","","","","","","","",""
"HE8YVACF","book","1931","Krautheimer, Jean","Gouvernement de la Cochinchine. Instructions relatives à l'assiette des rôles d'impôts directs et taxes assimilées de l'exercice 1931. [Signé : J. Krautheimer.]","","","","","","","1931","2021-03-30 07:57:21","2021-03-30 07:57:21","","","","","","","","Gouvernement de la Cochinchine. Instructions relatives à l'assiette des rôles d'impôts directs et taxes assimilées de l'exercice 1931. [Signé","","","","","","Saigon, impr. de l'Union Nguyên-Van-Cua","fre","","","","","BnF Catalogue général (http://catalogue.bnf.fr)","Tolbiac - Rez de Jardin - Droit, économie, politique - Magasin - 8-F-34275","Country: VN","","","http://catalogue.bnf.fr/ark:/12148/cb32324671q","","","Cochinchine","","","","","","","","","","","","","","","","","","","","","","","","","","","","","","","","","","","","","","","","","","","","",""
"UHIG46HV","book","1931","Krautheimer, Jean","Instructions du gouverneur de la Cochinchine, relatives à la réorganisation de la comptabilité des sociétés indigènes de crédit agricole mutuel","","","","","http://gallica.bnf.fr/ark:/12148/bpt6k932964g","","1931","2021-03-30 07:57:21","2021-03-30 07:57:21","2021-03-30 07:57:18","","65","","","1","","","","","","","impr. de l'Union Nguyèn-Van-Cua","Saïgon","fre","","","","","BnF Catalogue général (http://catalogue.bnf.fr)","Tolbiac - Rez de Jardin - Sciences et technique - Magasin - 4-S-3799","Country: VN in-8.","","","http://catalogue.bnf.fr/ark:/12148/cb323246722","","","Saigon","","","","","","","","","","","","","","","","","","","","","","","","","","","","","","","","","","","","","","","","","","","","",""
"9TRGHGJK","book","1931","Nhị Thiên Ðuờn̛g","Vê-sanh chỉ-nam","","","","","http://gallica.bnf.fr/ark:/12148/bpt6k42304845","Pharmacie Nhị-Thiên-Ðuờn̛g, catalogue","1931","2021-03-30 07:57:21","2021-03-30 07:57:21","2021-03-30 07:57:19","","372","","","","","","","","","","impr. Nguyễn Văn Của","Sài Gòn","fre","","","","","BnF Catalogue général (http://catalogue.bnf.fr)","Tolbiac - Rez de Jardin - Littérature et art - Magasin - 8-INDOCH-1311","Country: FR ill., fac-sim. 1931 d'après le dépôt légal.","","","http://catalogue.bnf.fr/ark:/12148/cb357574394","","","","","","","","","","","","","","","","","","","","","","","","","","","","","","","","","","","","","","","","","","","","","","","",""
"AMDRVPI2","book","1931","","Về vần-đế ruợư trong xú ̛Bắc-Kỳ cùng miến Bắc xú ̛Trung-Kỳ","","","","","http://gallica.bnf.fr/ark:/12148/bpt6k42389317","Le Problème de la distillation de l'alcool au Tonkin et au Nord-Annam. Economie","1931","2021-03-30 07:57:21","2021-03-30 07:57:21","2021-03-30 07:57:20","","","","","","","","","","","","impr. de l'Union Nguyễn Văn Của","Sài Gòn","fre","","","","","BnF Catalogue général (http://catalogue.bnf.fr)","Tolbiac - Rez de Jardin - Littérature et art - Magasin - 8-INDOCH PIECE-1708","Country: FR","","","http://catalogue.bnf.fr/ark:/12148/cb35760417b","","","","","","","","","","","","","","","","","","","","","","","","","","","","","","","","","","","","","","","","","","","","","","","",""
"GK3654KM","book","1932","Cathojeunesse","La Cathojeunesse présentera Sainte Cécile Vierge-Martyre...","","","","","","Sainte Cécile, Vierge-Martyre. Théâtre catholique","1932","2021-03-30 07:57:21","2021-03-30 07:57:21","","","","","","","","","","","","","Nguyễn Văn Cúa","Sài Gòn","fre vie","","","","","BnF Catalogue général (http://catalogue.bnf.fr)","Tolbiac - Rez de Jardin - Littérature et art - Magasin - MFICHE 8-INDOCH PIECE-2114","Country: FR Texte en français et en vietnamien.","","","http://catalogue.bnf.fr/ark:/12148/cb35751791m","","","","","","","","","","","","","","","","","","","","","","","","","","","","","","","","","","","","","","","","","","","","","","","",""
"X2DKJ6CG","book","1932","Cathojeunesse","La Cathojeunesse présentera Sainte Cécile Vierge-Martyre...","","","","","http://gallica.bnf.fr/ark:/12148/bpt6k4241411v","","1932","2021-03-30 07:57:21","2021-03-30 07:57:21","2021-03-30 07:57:21","","","","","","","","","","","","Nguyên Van-Cúa","Sàigon","fre","","","","","BnF Catalogue général (http://catalogue.bnf.fr)","Tolbiac - Rez de Jardin - Littérature et art - Magasin - 8-INDOCH PIECE-2114","Country: VN Sainte Cécile, Vierge-Martyre, théâtre catholique.","","","http://catalogue.bnf.fr/ark:/12148/cb338701435","","","","","","","","","","","","","","","","","","","","","","","","","","","","","","","","","","","","","","","","","","","","","","","",""
"3734ILDQ","book","1932","","Convention pour l'exploitation des services fluviaux, postaux et commerciaux à assurer entre Saigon, Phnompenh, Battambang et Luang-Prabang","","","","","","","1932","2021-03-30 07:57:55","2021-03-30 07:57:55","","","","","","","","","","","","","Impr. de l'Union Nguyên-van-cua","Saïgon","fre","","","","","BnF Catalogue général (http://catalogue.bnf.fr)","Tolbiac - Rez de Jardin - Sciences et technique - Magasin - 8-V-18688","Country: VN","","","http://catalogue.bnf.fr/ark:/12148/cb33326534v","","","","","","","","","","","","","","","","","","","","","","","","","","","","","","","","","","","","","","","","","","","","","","","",""
"Z46SXKVJ","book","1932","Bourayne, L.; Lafrique, G.","Manuel des justices de paix à compétence étendue, par L. Bourayne, procureur général, et G. Lafrique, avocat général. Saïgon","","","","","","","1932","2021-03-30 07:57:55","2021-03-30 07:57:55","","","","","","","","","","","","","","Saïgon, Impr. de l'Union, Nguyen-Van-Cua, 57, rue Lucien-Mossard","fre","","","","","BnF Catalogue général (http://catalogue.bnf.fr)","Tolbiac - Rez de Jardin - Droit, économie, politique - Magasin - 8-F-34996","Country: VN","","","http://catalogue.bnf.fr/ark:/12148/cb32338177k","","","","","","","","","","","","","","","","","","","","","","","","","","","","","","","","","","","","","","","","","","","","","","","",""
"72NVTJZY","book","1932","Duong-Tan-Tai","La Part de l'encens et du feu. Avec une introduction sur le culte des ancêtres et un aperçu général sur les biens du culte, par Duong-Tân-Tâi, ancien élève de l'École de droit et d'administration (Université indochinoise)","","","","","","","1932","2021-03-30 07:57:55","2021-03-30 07:57:55","","","","","","","","","","","","","","Saïgon, impr. de l'Union Nguyen-Van-Cua, 57, rue Lucien-Mossard","fre","","","","","BnF Catalogue général (http://catalogue.bnf.fr)","Tolbiac - Rez de Jardin - Philosophie, histoire, sciences de l'homme - Magasin - 8-O2L-828","Country: FR","","","http://catalogue.bnf.fr/ark:/12148/cb32058656w","","","","","","","","","","","","","","","","","","","","","","","","","","","","","","","","","","","","","","","","","","","","","","","",""
"JS6ZBV5V","book","1932","","Quang-thánh dai-dế linh-xăm...","","","","","","Les Oracles de Quang-Thánh dại-dế","1932","2021-03-30 07:57:55","2021-03-30 07:57:55","","","","","","","","","","","","","impr. de l'Union Nguyễn Văn Cũa","Sài Gòn","fre","","","","","BnF Catalogue général (http://catalogue.bnf.fr)","Tolbiac - Rez de Jardin - Littérature et art - Magasin - MFICHE 8-INDOCH-1747","Country: FR","","","http://catalogue.bnf.fr/ark:/12148/cb35758166f","","","","","Trâǹ, Quang Thuận","","","","","","","","","","","","","","","","","","","","","","","","","","","","","","","","","","","","","","","","","","",""
"WB6I9I2V","book","1932","Ordre des avocats","Conseil de l'ordre des avocats à la cour d'appel de Saigon. Règlement intérieur du barreau de Saigon. Décrets du 25 mai 1930 et du 24 juillet 1931 et arrêté de promulgation","","","","","","","1932","2021-03-30 07:57:55","2021-03-30 07:57:55","","","","","","","","","","","","","Impr. de l'union Nguyèn-Van-Cua","Saigon","fre","","","","","BnF Catalogue général (http://catalogue.bnf.fr)","Tolbiac - Rez de Jardin - Philosophie, histoire, sciences de l'homme - Magasin - 8-LF125-347","Country: VN","","","http://catalogue.bnf.fr/ark:/12148/cb34069464p","","Avocats -- France (1789-....)","","","","","","","","","","","","","","","","","","","","","","","","","","","","","","","","","","","","","","","","","","","","","",""
