"RG63W8QN","book","1932","Lemaître, Marcel-Jules Albert-Paul","Religions, Cultes. Rites et Superstitions en terre d'Annam. Influence de l'idée religieuse et de l'idée philosophique sur la vie politique et sociale du peuple annamite. Conférence faite aux officiers de la garnison de Saïgon, le 17 septembre 1932, par le capitaine Lemaître, de l'artillerie coloniale","","","","","","","1932","2021-03-30 07:57:55","2021-03-30 07:57:55","","","","","","","","","","","","","","Saïgon, Impr. de l'Union Nguyên-van-Cua, 57, rue Lucien-Mossard","fre","","","","","BnF Catalogue général (http://catalogue.bnf.fr)","Tolbiac - Rez de Jardin - Philosophie, histoire, sciences de l'homme - Magasin - 8-O2L-834","Country: VN","","","http://catalogue.bnf.fr/ark:/12148/cb32370166t","","Hô Chi Minh-Ville (Hô Chi Minh-Ville, Viêt Nam)","","","","","","","","","","","","","","","","","","","","","","","","","","","","","","","","","","","","","","","","","","","","","",""
"VN3CENR3","book","1932","Nguyên, Van Hai","Thuật lại cuộc hành trình nhon̛ dịp dụ ̛cuộc đâu xáo các thuộc-địa và các nuớc̛ tại Paris năm 1931","","","","","http://gallica.bnf.fr/ark:/12148/bpt6k4232888t","Souvenir de voyage à l'occasion de l'Exposition Internationale et coloniale à Paris en 1931","1932","2021-03-30 07:57:55","2021-03-30 07:57:55","2021-03-30 07:57:49","","56","","","","","","","","","","Impr. de l'Union Nguyễn Văn Cua̛","Sài Gòn","fre","","","","","BnF Catalogue général (http://catalogue.bnf.fr)","Tolbiac - Rez de Jardin - Littérature et art - Magasin - 8-INDOCH-1777","Country: FR ill.","","","http://catalogue.bnf.fr/ark:/12148/cb35757146k","","","","","","","","","","","","","","","","","","","","","","","","","","","","","","","","","","","","","","","","","","","","","","","",""
"5LPMXFHV","book","1932","Việt-Nam Ngân hàng","Việt-nam ngân hàng... :  Ðại hội đồng thuờn̛g niên ngày 23 tháng chín năm 1932","","","","","http://gallica.bnf.fr/ark:/12148/bpt6k4241590t","Société vietnamienne de crédit. Assemblée générale du 23-9-1932","1932","2021-03-30 07:57:55","2021-03-30 07:57:55","2021-03-30 07:57:49","","","","","","","Việt-nam ngân hàng...","","","","","Impr. Nguyên Văn Của","Sài Gòn","fre","","","","","BnF Catalogue général (http://catalogue.bnf.fr)","Tolbiac - Rez de Jardin - Littérature et art - Magasin - 8-INDOCH PIECE-2078 (1932)","Country: FR","","","http://catalogue.bnf.fr/ark:/12148/cb35760586f","","","","","","","","","","","","","","","","","","","","","","","","","","","","","","","","","","","","","","","","","","","","","","","",""
"9CLPKEXF","book","1933","","Art chinois. Notes sur un sceau mandarinal. Ancien sceau chinois composé de deux trigrammes et de deux caractères tch'oan à forme sigillaire. Transcription en caractères modernes","","","","","","","1933","2021-03-30 07:57:55","2021-03-30 07:57:55","","","11","","","","","","","","","","Nguyen-Van-Cua","Saïgon","fre","","","","","BnF Catalogue général (http://catalogue.bnf.fr)","Tolbiac - Rez de Jardin - Sciences et technique - Magasin - 8-V PIECE-24312","Country: VN","","","http://catalogue.bnf.fr/ark:/12148/cb33247061v","","","","","","","","","","","","","","","","","","","","","","","","","","","","","","","","","","","","","","","","","","","","","","","",""
"YFECYYYH","book","1933","","Gouvernement général de l'Indochine. Service de l'inscription maritime. Police de la navigation. Livret d'identité de marin indigène...","","","","","http://gallica.bnf.fr/ark:/12148/bpt6k6527158p","","1933","2021-03-30 07:57:55","2021-03-30 07:57:55","2021-03-30 07:57:50","","","","","","","","","","","","impr. de l'Union Nguyên Van-Cua","Saïgon","fre","","","","","BnF Catalogue général (http://catalogue.bnf.fr)","Tolbiac - Rez de Jardin - Droit, économie, politique - Magasin - 8-F PIECE-7372","Country: VN","","","http://catalogue.bnf.fr/ark:/12148/cb33982930w","","","","","","","","","","","","","","","","","","","","","","","","","","","","","","","","","","","","","","","","","","","","","","","",""
"273DS6P9","book","1933","Mossy, Léon","Principes d'administration générale de l'Indochine","","","","","http://gallica.bnf.fr/ark:/12148/bpt6k373953r","","1933","2021-03-30 07:57:55","2021-03-30 07:57:55","2021-03-30 07:57:51","","","","","1","","","","","","","Impr. de l'Union Nguyên-Van-Cua","Saïgon","fre","","","","","BnF Catalogue général (http://catalogue.bnf.fr)","Tolbiac - Rez de Jardin - Philosophie, histoire, sciences de l'homme - Magasin - 8-O2L-836","Country: VN in-8.","","","http://catalogue.bnf.fr/ark:/12148/cb32469313x","","","","","","","","","","","","","","","","","","","","","","6e édition, revue et augmentée","","","","","","","","","","","","","","","","","","","","","","","","","",""
"MLJZUPZX","book","1933","","Querelle des six animaux sur leurs mérites respectifs, traduction française avec préface et commentaires, par P. Midan, des Lục súc tranh công, poème transcrit du sino-annamite en quốc-[...] et annoté par Pétrus Truong-Vinh-Ky...","","","","","","","1933","2021-03-30 07:57:55","2021-03-30 07:57:55","","","","","","","","","","","","","Impr. de l'Union Nguyên-Van-Cua","Saigon","fre","","","","","BnF Catalogue général (http://catalogue.bnf.fr)","Tolbiac - Rez de Jardin - Littérature et art - Magasin - 8-Z PIECE-3212","Country: VN","","","http://catalogue.bnf.fr/ark:/12148/cb33561052c","","","","","","","","","","","","","","","","","","","","","","","","","","","","","","","","","","","","","","","","","","","","","","","",""
"WJXHPHL8","book","1934","","Cách thuộc da","","","","","http://gallica.bnf.fr/ark:/12148/bpt6k42443546","Méthode de tannage. Industrie","1934","2021-03-30 07:57:55","2021-03-30 07:57:55","2021-03-30 07:57:52","","","","","","","","","","","","Impr. de l'Union Nguyễn Văn Của","Sài Gòn","fre","","","","","BnF Catalogue général (http://catalogue.bnf.fr)","Tolbiac - Rez de Jardin - Littérature et art - Magasin - 8-INDOCH PIECE-2707","Country: FR","","","http://catalogue.bnf.fr/ark:/12148/cb35751682c","","","","","","","","","","","","","","","","","","","","","","","","","","","","","","","","","","","","","","","","","","","","","","","",""
"AY4MLEK9","book","1934","","Diệu-pháp liên-hoa kinh, Quan-thế-âm bồ-tát, Phổ-mốn phâm","","","","","http://gallica.bnf.fr/ark:/12148/bpt6k42442521","Saḍdharmapuṇdarīka. Avalokiteṣvara, Samanta mukhaparivarta","1934","2021-03-30 07:57:55","2021-03-30 07:57:55","2021-03-30 07:57:53","","18","","","","","","","","","","impr. Nguyễn Văn-Của","Sài Gòn","fre","","","","","BnF Catalogue général (http://catalogue.bnf.fr)","Tolbiac - Rez de Jardin - Littérature et art - Magasin - 8-INDOCH PIECE-2737","Country: FR couv. ill.","","","http://catalogue.bnf.fr/ark:/12148/cb35752295v","","","","","Lê, Phuơc̛ Chí","","","","","","","","","","","","","","","","","","","","","","","","","","","","","","","","","","","","","","","","","","",""
"B6378C9G","book","1934","","Enseignement franco-indigène du premier degré en Cochinchine. Règlement scolaire","","","","","","","1934","2021-03-30 07:57:55","2021-03-30 07:57:55","","","","","","","","","","","","","impr. de l'Union Nguyen-Van-Cua","Saigon","fre","","","","","BnF Catalogue général (http://catalogue.bnf.fr)","Tolbiac - Rez de Jardin - Philosophie, histoire, sciences de l'homme - Magasin - 8-R-41776","Country: VN","","","http://catalogue.bnf.fr/ark:/12148/cb33368169q","","","","","","","","","","","","","","","","","","","","","","","","","","","","","","","","","","","","","","","","","","","","","","","",""
"XSYV726P","book","1934","","Enseignement franco-indigène du premier degré en Cochinchine. Textes administratifs, annexe au règlement scolaire","","","","","","","1934","2021-03-30 07:57:55","2021-03-30 07:57:55","","","","","","","","","","","","","impr. de l'Union-Nguyen-Văn-Cua","Saïgon","fre","","","","","BnF Catalogue général (http://catalogue.bnf.fr)","Tolbiac - Rez de Jardin - Philosophie, histoire, sciences de l'homme - Magasin - 8-O2L-885","Country: VN","","","http://catalogue.bnf.fr/ark:/12148/cb33368170x","","","","","","","","","","","","","","","","","","","","","","","","","","","","","","","","","","","","","","","","","","","","","","","",""
"XB62QXXU","book","1934","Le Bret, Georges","Fédération des syndicats de Cochinchine. Rapport sur l'organisation du crédit agricole, présenté par M. Georges Le Bret,...","","","","","","","1934","2021-03-30 07:57:55","2021-03-30 07:57:55","","","","","","","","","","","","","","Saïgon, impr. de Nguyên-van-Cua","fre","","","","","BnF Catalogue général (http://catalogue.bnf.fr)","Tolbiac - Rez de Jardin - Philosophie, histoire, sciences de l'homme - Magasin - 4-O2L-888","Country: VN Supplément au ""Bulletin du syndicat agricole français de Cochinchine.","","","http://catalogue.bnf.fr/ark:/12148/cb323600352","","","Fédération des syndicats de Cochinchine","","","","","","","","","","","","","","","","","","","","","","","","","","","","","","","","","","","","","","","","","","","","",""
"W8KEILQ2","book","1934","","Kinh A-Di-Ðà, Hồng-Danh, Vu-Lang...","","","","","http://gallica.bnf.fr/ark:/12148/bpt6k4231996d","","1934","2021-03-30 07:57:55","2021-03-30 07:57:55","2021-03-30 07:57:55","","90","","","","","","","","","","Impr. de l'Union Nguyễn Văn Cũa","Sài Gòn","fre","","","","","BnF Catalogue général (http://catalogue.bnf.fr)","Tolbiac - Rez de Jardin - Littérature et art - Magasin - 8-INDOCH-2007","Country: FR ill.","","","http://catalogue.bnf.fr/ark:/12148/cb357541921","","","","","","","","","","","","","","","","","","","","","","","","","","","","","","","","","","","","","","","","","","","","","","","",""
"R4M4755V","book","1934","","Kinh A-Di-Ðà, Hồng-Danh, Vu-Lang diễn-nghĩa...","","","","","http://gallica.bnf.fr/ark:/12148/bpt6k4233909v","Sukhavāti amṛta vȳnha,... Avalambana","1934","2021-03-30 07:57:55","2021-03-30 07:57:55","2021-03-30 07:57:55","","87","","","","","","Nam-kỳ nghiên-cúư phật-học hội","","","","Impr. de l'Union Nguyễn-Văn Cũa","Sài Gòn","fre","","","","","BnF Catalogue général (http://catalogue.bnf.fr)","Tolbiac - Rez de Jardin - Littérature et art - Magasin - 8-INDOCH-1993","Country: FR portr.","","","http://catalogue.bnf.fr/ark:/12148/cb35754191p","","","","","","","","","","","","","","","","","","","","","","","","","","","","","","","","","","","","","","","","","","","","","","","",""
"XV4ND74H","book","1934","","Ligue des droits de l'homme et du citoyen. Section de Saïgon. Le coup de main fasciste et la riposte républicaine, textes et documents  [Avant propos de C. Metter]","","","","","","","1934","2021-03-30 07:57:55","2021-03-30 07:57:55","","","","","","","","","","","","","Impr. de l'Union Nguyen-Van-Cua","Saïgon","fre","","","","","BnF Catalogue général (http://catalogue.bnf.fr)","Tolbiac - Rez de Jardin - Philosophie, histoire, sciences de l'homme - Magasin - 4-LB57-16285","Country: VN","","","http://catalogue.bnf.fr/ark:/12148/cb34189466z","","France (1870-1940, 3e République)","","","","","","","","","","","","","","","","","","","","","","","","","","","","","","","","","","","","","","","","","","","","","",""
"IVNZNRYD","book","1934","","La Pagade des clochetons et la pagade Barbé, contribution à l'histoire de Saïgon-Chalon , par P. Midan...","","","","","http://gallica.bnf.fr/ark:/12148/bpt6k58484909","","1934","2021-03-30 07:58:22","2021-03-30 07:58:22","2021-03-30 07:58:14","","","","","","","","","","","","Impr. de l'Union Nguyên-van-Cua","Saïgon","fre","","","","","BnF Catalogue général (http://catalogue.bnf.fr)","Tolbiac - Rez de Jardin - Philosophie, histoire, sciences de l'homme - Magasin - 8-LK10-865","Country: VN Editions de l'Asie nouvelle.","","","http://catalogue.bnf.fr/ark:/12148/cb341991879","","Cochinchine (Viet-Nam) (HB); France -- Colonies -- Histoire (HB)","","","","","","","","","","","","","","","","","","","","","","","","","","","","","","","","","","","","","","","","","","","","","",""
"QDZCNKDC","book","1934","Midan, P.","La Pagode des clochetons et la pagode Barbé, contribution à l'histoire de Saïgon-Cholon, par P. Midan...","","","","","","","1934","2021-03-30 07:58:22","2021-03-30 07:58:22","","","","","","","","","","","","","","Saïgon, Impr. de l'Union Nguyên-van-Cua","fre","","","","","BnF Catalogue général (http://catalogue.bnf.fr)","Tolbiac - Rez de Jardin - Philosophie, histoire, sciences de l'homme - Magasin - 8-LK10-865","Country: VN Éditions de l'Asie nouvelle.","","","http://catalogue.bnf.fr/ark:/12148/cb32449840s","","","","","","","","","","","","","","","","","","","","","","","","","","","","","","","","","","","","","","","","","","","","","","","",""
"PHT7XD9S","book","1934","","Police de l'Indochine. Cochinchine. Section administrative et judiciaire. Liste alphabétique générale des individus qui ont fait l'objet d'avis de recherches insérés au Bulletin de police criminelle du N° 1 au N° 239 inclus et qui n'ont pas été signalés comme ayant cessé d'être recherchés au 21 décembre 1938. Annexe au Bulletin de police criminelle N° 275 du 8 septembre 1934","","","","","","","1934","2021-03-30 07:58:22","2021-03-30 07:58:22","","","","","","","","","","","","","impr. de l'Union Nguyen-Van-Cua","Saïgon","fre","","","","","BnF Catalogue général (http://catalogue.bnf.fr)","Tolbiac - Rez de Jardin - Philosophie, histoire, sciences de l'homme - Magasin - 8-O2L-893","Country: VN","","","http://catalogue.bnf.fr/ark:/12148/cb33542302g","","","","","","","","","","","","","","","","","","","","","","","","","","","","","","","","","","","","","","","","","","","","","","","",""
"ANGLBADI","book","1934","Wilser, Ludwig; Daudin, Pierre","Qu'est-ce que la croix gammée ? [""Das Hakenkreuz nach Ursprung, Vorkommen und Bedeutung"".] Dr. Ludwig Wilser. Traduit de l'allemand par P. Daudin,... [Documentation hors texte sur la croix gammée en Chine et en Indochine, signé P. Daudin.]","","","","","","","1934","2021-03-30 07:58:22","2021-03-30 07:58:22","","","44","","","","","Qu'est-ce que la croix gammée ?","","","","","impr. de l'Union Nguyen-Van-Cua","Saïgon","fre","","","","","BnF Catalogue général (http://catalogue.bnf.fr)","Tolbiac - Rez de Jardin - Philosophie, histoire, sciences de l'homme - Magasin - 8-M PIECE-6339","Country: VN Édition de l'Asie nouvelle.","","","http://catalogue.bnf.fr/ark:/12148/cb316547265","","","","","","","","","","","","","","","","","","","","","","","","","","","","","","","","","","","","","","","","","","","","","","","",""
"E6QE2HZH","book","1934","Nguyêñ, P. J. B. Trọng Quản; Midan, P.","Nguyē̂n-Trọng-Quản. L'Histoire de Lazarô Phiên. Traduction en français de Nguyē̂n-Trọng-Dăc. Avant-propos de P. Midan...","","","","","","","1934","2021-03-30 07:58:22","2021-03-30 07:58:22","","","","","","","","","","","","","","Saigon, Impr. de l'Union Nguyên-Van-Cua","fre","","","","","BnF Catalogue général (http://catalogue.bnf.fr)","Tolbiac - Rez de Jardin - Philosophie, histoire, sciences de l'homme - Magasin - 8-O2S-380","Country: VN Edition de l'Asie nouvelle.","","","http://catalogue.bnf.fr/ark:/12148/cb324848454","","","","","Nguyễn, Trọng Đắc","Midan, P.","","","","","","","","","","","","","","","","","","","","","","","","","","","","","","","","","","","","","","","","","",""
"XWB9JNYU","book","1935","Huệ, Ðăng; Phạm, Hũư Ðúc̛; Thiên Thai Thiền giáo tông Liên Hũư hội","Ðiều lê và qui điều nội trị","","","","","http://gallica.bnf.fr/ark:/12148/bpt6k42416015","Contient également ""Bài diễn Văn"", par Phạm Hũư Ðúc̛ (Chánh Hội Truởn̛g) et ""Bài thuyết pháp"", par Huệ Ðăng (Hoà thuợn̛g)","1935","2021-03-30 07:58:22","2021-03-30 07:58:22","2021-03-30 07:58:15","","","","","","","","","","","","Impr. de l'Union Nguyễn Văn Của","Sài Gòn","fre","","","","","BnF Catalogue général (http://catalogue.bnf.fr)","Tolbiac - Rez de Jardin - Littérature et art - Magasin - 4-INDOCH-118","Country: FR","","","http://catalogue.bnf.fr/ark:/12148/cb357593009","","","","","","","","","","","","","","","","","","","","","","","","","","","","","","","","","","","","","","","","","","","","","","","",""
"SU8L4NMY","book","1936","Thiên Thai Thiền giáo tông Liên Hũư hội","[Bài] Thuyết pháp","","","","","http://gallica.bnf.fr/ark:/12148/bpt6k4244064j","La couv. porte : ""... Huệ Ðăng Hoà thuợn̛g chún̛g minh","1936","2021-03-30 07:58:22","2021-03-30 07:58:22","2021-03-30 07:58:16","","","","","","","","","","","","impr. de l'Union Nguyễn Văn Của","Sài Gòn","fre","","","","","BnF Catalogue général (http://catalogue.bnf.fr)","Tolbiac - Rez de Jardin - Littérature et art - Magasin - 4-INDOCH-119","Country: FR","","","http://catalogue.bnf.fr/ark:/12148/cb35759299x","","","","","","","","","","","","","","","","","","","","","","","","","","","","","","","","","","","","","","","","","","","","","","","",""
"DXDPBJT2","book","1936","Huệ, Ðăng; Thiên Thai Thiền giáo tông Liên Hũư hội; Thiên Thai Thiền giáo tông Liên Hũư hội","Phật thuyết A-Di-Ðà kinh diễn nghĩa   Tinh-độ Chánh tông","","","","","http://gallica.bnf.fr/ark:/12148/bpt6k4245564k","Prières bouddhiques","1936","2021-03-30 07:58:22","2021-03-30 07:58:22","2021-03-30 07:58:17","","","","","","","","","","","","impr. de l'union Nguyễn Văn của","Sài Gòn","fre","","","","","BnF Catalogue général (http://catalogue.bnf.fr)","Tolbiac - Rez de Jardin - Littérature et art - Magasin - 4-INDOCH-120","Country: FR","","","http://catalogue.bnf.fr/ark:/12148/cb35759303b","","","","","","Huệ, Ðăng","","","","","","","","","","","","","","","","","","","","","","","","","","","","","","","","","","","","","","","","","",""
"3IY3C5NH","book","1936","Bois, Georges; Phạm, Quỳnh","Pour un confucianisme nouveau. Préface de S. E. Pham-Quynh,...","","","","","","","1936","2021-03-30 07:58:22","2021-03-30 07:58:22","","","","","","","","","","","","","","Saïgon, Impr. de l'Union Nguyen-Van-Cua","fre","","","","","BnF Catalogue général (http://catalogue.bnf.fr)","Tolbiac - Rez de Jardin - Philosophie, histoire, sciences de l'homme - Magasin - 8-R-46376","Country: VN","","","http://catalogue.bnf.fr/ark:/12148/cb31835157z","","","","","","Phạm, Quỳnh","","","","","","","","","","","","","","","","","","","","","","","","","","","","","","","","","","","","","","","","","",""
"7QUNFTBW","book","1937","Mariani, Jacques-Marie","La Cochinchine agricole. Le passé, le présent, l'avenir","","","","","","","1937","2021-03-30 07:58:22","2021-03-30 07:58:22","","","","","","","","","","","","","","Saigon, impr. de Nguyen-Van-Cua","fre","","","","","BnF Catalogue général (http://catalogue.bnf.fr)","Tolbiac - Rez de Jardin - Sciences et technique - Magasin - 8-S-20285","Country: VN","","","http://catalogue.bnf.fr/ark:/12148/cb324188460","","","","","","","","","","","","","","","","","","","","","","","","","","","","","","","","","","","","","","","","","","","","","","","",""
"8LDMYLFE","book","1937","Nguyễn, Văn Hoanh","Tù ̛-hàn tân soạn... chiếu theo chĩ-dụ 21 juillet 1925 30 mai 1932 và 24 avril 1934...","","","","","http://gallica.bnf.fr/ark:/12148/bpt6k4234893r","Formulaire des actes en matière indigène conformément aux décrets des 25 juillet 1925","1937","2021-03-30 07:58:22","2021-03-30 07:58:22","2021-03-30 07:58:18","","","","","","","","","","","","Impr. de l'Union Nguyễn Văn Của","Sài Gòn","fre","","","","","BnF Catalogue général (http://catalogue.bnf.fr)","Tolbiac - Rez de Jardin - Littérature et art - Magasin - 8-INDOCH-2369","Country: FR","","","http://catalogue.bnf.fr/ark:/12148/cb357571546","","","","","","","","","","","","","","","","","","","","","","","","","","","","","","","","","","","","","","","","","","","","","","","",""
"9A7QSM9D","book","1939","","Région de Saigon-Cholon. Service des Pensions du personnel européen des services régionaux et municipaux de Saïgon-Cholon","","","","","","","1939","2021-03-30 07:58:22","2021-03-30 07:58:22","","","","","","","","","","","","","Impr. de l'Union Nguyen-Van-Cua","Saigon","fre","","","","","BnF Catalogue général (http://catalogue.bnf.fr)","Tolbiac - Rez de Jardin - Droit, économie, politique - Magasin - 8-F-40771","Country: VN","","","http://catalogue.bnf.fr/ark:/12148/cb335748546","","","","","","","","","","","","","","","","","","","","","","","","","","","","","","","","","","","","","","","","","","","","","","","",""
"6U8J7QMP","book","1940","","Lục-Tõ̂ Pháp-Bão-Ðàn kinh :  Sam-Hoi-Phâm dê luc","","","","","http://gallica.bnf.fr/ark:/12148/bpt6k4243791j","Lieou tsou fa pao t'an king","1940","2021-03-30 07:58:22","2021-03-30 07:58:22","2021-03-30 07:58:19","","","","","","","Lục-Tõ̂ Pháp-Bão-Ðàn kinh","","","","","Impr. de l'Union Nguyễn Văn Của","Sài Gòn","fre","","","","","BnF Catalogue général (http://catalogue.bnf.fr)","Tolbiac - Rez de Jardin - Littérature et art - Magasin - 8-INDOCH PIECE-4265","Country: FR","","","http://catalogue.bnf.fr/ark:/12148/cb357551045","","","","","","","","","","","","","","","","","","","","","","","","","","","","","","","","","","","","","","","","","","","","","","","",""
"JR3XNIIZ","book","1941","Association mutuelle des journalistes Cochinchinois","Association mutuelle des journalistes cochinchinois. Règlements spéciaux","","","","","","","1941","2021-03-30 07:58:22","2021-03-30 07:58:22","","","","","","","","","","","","","impr. de Nguyen-Van-Cua","Saïgon","fre","","","","","BnF Catalogue général (http://catalogue.bnf.fr)","Tolbiac - Rez de Jardin - Philosophie, histoire, sciences de l'homme - Magasin - 8-R PIECE-23946","Country: VN","","","http://catalogue.bnf.fr/ark:/12148/cb338596450","","","","","","","","","","","","","","","","","","","","","","","","","","","","","","","","","","","","","","","","","","","","","","","",""
"D6C6JRQY","book","1941","Hộ, Tông","Thanh-Tịnh kinh giải...","","","","","http://gallica.bnf.fr/ark:/12148/bpt6k42439932","Visuddhi Katha commenté","1941","2021-03-30 07:58:22","2021-03-30 07:58:22","2021-03-30 07:58:21","","","","","","","","Ðao Phật Thích-ca","","","","Impr. de l'Union Nguyễn Văn Của","Sài Gòn","fre","","","","","BnF Catalogue général (http://catalogue.bnf.fr)","Tolbiac - Rez de Jardin - Littérature et art - Magasin - 16-INDOCH-1435","Country: FR","","","http://catalogue.bnf.fr/ark:/12148/cb35753446f","","","","","","","","","","","","","","","","","","","","","","","","","","","","","","","","","","","","","","","","","","","","","","","",""
"P2SNWQXL","book","1942","","Ðại tú ̛niệm xú ̛kinh :  (Mahâ Satipatthâna Sutta)...","","","","","http://gallica.bnf.fr/ark:/12148/bpt6k4243935m","Mahā Satipaṭṭhāna Sụtta. Texte du Canon Pāli","1942","2021-03-30 07:58:22","2021-03-30 07:58:22","2021-03-30 07:58:21","","","","","","","Ðại tú ̛niệm xú ̛kinh","Ðạo Phật Thích-ca","","","","Impr. de l'Union Nguyễn Văn Của","Sài Gòn","fre","","","","","BnF Catalogue général (http://catalogue.bnf.fr)","Tolbiac - Rez de Jardin - Littérature et art - Magasin - 16-INDOCH-1430","Country: FR","","","http://catalogue.bnf.fr/ark:/12148/cb35752655q","","","","","Lê, Văn Giãng","","","","","","","","","","","","","","","","","","","","","","","","","","","","","","","","","","","","","","","","","","",""
"MX68H5I7","book","1946","Peautonnier, G.","Contribution à l'étude des conditions d'exploitation de la rizière en Cochinchine...","","","","","","","1946","2021-03-30 07:58:22","2021-03-30 07:58:22","","","32","","","","","","Supplément au Bulletin de renseignements économiques","","","","Édition du Service des études économiques","Saïgon","fre","","","","","BnF Catalogue général (http://catalogue.bnf.fr)","Tolbiac - Rez de Jardin - Philosophie, histoire, sciences de l'homme - Magasin - 4-R-6131 (3)","Country: VN 27 cm. Fédération indochinoise. Commissariat fédéral aux affaires économiques. Numéro de : Supplément au Bulletin de renseignements économiques, n° 3 (1946, octobre).","","","http://catalogue.bnf.fr/ark:/12148/cb32513719s","","","Indochine française","","","","","","","","","","","","","","","","","","","","","","","","","","","","","","","","","","","","","","","","","","","","",""
"25KUDP65","book","1946","","La culture des plantes oléagineuses en Indochine...","","","","","","","1946","2021-03-30 07:58:22","2021-03-30 07:58:22","","","41","","","","","","Supplément au Bulletin de renseignements économiques","","","","Édition du Service des études économiques","Saïgon","fre","","","","","BnF Catalogue général (http://catalogue.bnf.fr)","Tolbiac - Rez de Jardin - Philosophie, histoire, sciences de l'homme - Magasin - 4-R-6131 (4)","Country: VN 27 cm. Fédération indochinoise. Commissariat fédéral aux affaires économiques. Numéro de : Supplément au Bulletin de renseignements économiques, n° 4 (1946, novembre).","","","http://catalogue.bnf.fr/ark:/12148/cb333353499","","","","","","","","","","","","","","","","","","","","","","","","","","","","","","","","","","","","","","","","","","","","","","","",""
